{
  "case_id": "X3_SCHEDULING_RECOVERY_V5_20261008_223402_421810_R33_STATIC_X3_8f69c5fbed058e3d95ee1d0b",
  "task_type": "X3",
  "joint_feasible": true,
  "oracle_certification": "EXACT_CERTIFIED",
  "optimal_delta_tso": 12,
  "optimal_wufr_at_optimal_delta_tso": 0.5806437597854435,
  "equivalent_optimum_count": 1,
  "oracle_search_nodes": 1792,
  "oracle_evaluated_optimal_solutions": 888
}