{
  "case_id": "X3_UNIFIED_CANDIDATE_20261008_051958_574121_OX_d707be7f7a21d428d276",
  "equivalent_optimum_count": 1,
  "joint_feasible": true,
  "optimal_delta_tso": 12,
  "optimal_wufr_at_optimal_delta_tso": 0.8638100608894224,
  "oracle_certification": "EXACT_CERTIFIED",
  "oracle_evaluated_optimal_solutions": 30,
  "oracle_search_nodes": 74,
  "task_type": "X3"
}
